{
  "userId": "42",
  "conversationId": null,
  "action": "effect_revoke",
  "detail": "revoke effect #9281 (crm_task) → revoked",
  "model": null,
  "provider": null,
  "promptTokens": null,
  "completionTokens": null,
  "durationMs": null,
  "isError": false,
  "errorMessage": null,
  "authorization": null,
  "feedback": null,
  "feedbackNote": null,
  "businessEvent": null,
  "evidence": null,
  "agentId": null,
  "sessionId": null,
  "parentActionId": null,
  "callerAgentId": null,
  "delegationContext": null,
  "businessIntent": null,
  "source": "sandbox"
}
