{
  "userId": "42",
  "conversationId": "conv-318-abc",
  "action": "tool_call",
  "detail": "create_event({\"title\":\"meeting\"})",
  "model": "deepseek-v4-flash",
  "provider": "deepseek",
  "promptTokens": 320,
  "completionTokens": 64,
  "durationMs": 812,
  "isError": false,
  "errorMessage": null,
  "authorization": "{\"allowed\":true,\"tool\":\"create_event\",\"riskLevel\":\"R3\",\"strategy\":\"confirmation\",\"checks\":[]}",
  "feedback": null,
  "feedbackNote": null,
  "businessEvent": null,
  "evidence": null,
  "agentId": null,
  "sessionId": null,
  "parentActionId": null,
  "callerAgentId": null,
  "delegationContext": null,
  "businessIntent": null,
  "source": null
}
